{
  "envelope_id": "env.mova_agent_task_execute_v1",
  "verb": "execute",
  "roles": {
    "requester": "user:sergii",
    "executor": "agent.math-proof.v1"
  },
  "task": {
    "task_id": "task-math-001",
    "intent_text": "Prove equivalence of measures under smooth shift.",
    "success_definition": "Return deterministic answer with verification steps.",
    "constraints": [
      "No unsafe side effects",
      "Use observability logs"
    ],
    "input_refs": [
      "file://tasks/math_001.md"
    ]
  },
  "agent_profile_ref": "agent.math-proof.v1@1.0.0",
  "policy_profile_ref": "mova_security_default_v1@1.0.0",
  "determinism": {
    "seed": 42,
    "replay_mode": true
  }
}
